{
  "schemaVersion": "1.0.0",
  "kind": "componentMetadata",
  "tokenStandard": "ERC1155",
  "network": "base",
  "chainId": 8453,
  "contractAddress": "0xae6fd8664Ba6E147bfb7bb1Ed4354F60Fc86854e",
  "componentDefinitionId": 3,
  "name": "Crystal Core",
  "description": "Published metadata for Crystal Core in the live Inpinity City system.",
  "image": "https://assets.inpinity.online/city/assets/components/3.png",
  "external_url": "https://assets.inpinity.online/city/metadata/components/3.json",
  "attributes": [
    {
      "trait_type": "Component Definition ID",
      "value": 3,
      "display_type": "number"
    },
    {
      "trait_type": "Category",
      "value": 3,
      "display_type": "number"
    },
    {
      "trait_type": "Category Label",
      "value": "Core"
    },
    {
      "trait_type": "Rarity Tier",
      "value": 2,
      "display_type": "number"
    },
    {
      "trait_type": "Rarity",
      "value": "Rare"
    },
    {
      "trait_type": "Tech Tier",
      "value": 2,
      "display_type": "number"
    },
    {
      "trait_type": "Tech Tier Label",
      "value": "Refined"
    },
    {
      "trait_type": "Enabled",
      "value": "Yes"
    }
  ],
  "generatedAt": "2026-03-18T10:22:05.163Z",
  "sourceContract": "0xae6fd8664Ba6E147bfb7bb1Ed4354F60Fc86854e",
  "sourceReadMethod": "componentDefinitionOf",
  "sourceMode": "chain",
  "verificationStatus": "confirmed",
  "notes": "Generated from live CityComponents componentDefinitionOf(3) on base.",
  "rarityPresentation": {
    "rarityTier": 2,
    "key": "rare",
    "name": "Rare",
    "frame": {
      "path512": "assets/frames/512/rare.png",
      "publicUrl": "https://assets.inpinity.online/city/assets/frames/512/rare.png",
      "transparentCenter": true,
      "masterSize": 512
    },
    "background": {
      "path512": "assets/backgrounds/512/rare.png",
      "publicUrl": "https://assets.inpinity.online/city/assets/backgrounds/512/rare.png",
      "masterSize": 512
    }
  }
}
