{
  "schemaVersion": "1.0.0",
  "kind": "componentMetadata",
  "tokenStandard": "ERC1155",
  "network": "base",
  "chainId": 8453,
  "contractAddress": "0xae6fd8664Ba6E147bfb7bb1Ed4354F60Fc86854e",
  "componentDefinitionId": 2,
  "name": "Reinforced Hilt",
  "description": "Published metadata for Reinforced Hilt in the live Inpinity City system.",
  "image": "https://assets.inpinity.online/city/assets/components/2.png",
  "external_url": "https://assets.inpinity.online/city/metadata/components/2.json",
  "attributes": [
    {
      "trait_type": "Component Definition ID",
      "value": 2,
      "display_type": "number"
    },
    {
      "trait_type": "Category",
      "value": 2,
      "display_type": "number"
    },
    {
      "trait_type": "Category Label",
      "value": "Hilt"
    },
    {
      "trait_type": "Rarity Tier",
      "value": 1,
      "display_type": "number"
    },
    {
      "trait_type": "Rarity",
      "value": "Common"
    },
    {
      "trait_type": "Tech Tier",
      "value": 1,
      "display_type": "number"
    },
    {
      "trait_type": "Tech Tier Label",
      "value": "Primitive"
    },
    {
      "trait_type": "Enabled",
      "value": "Yes"
    }
  ],
  "generatedAt": "2026-03-18T10:22:04.730Z",
  "sourceContract": "0xae6fd8664Ba6E147bfb7bb1Ed4354F60Fc86854e",
  "sourceReadMethod": "componentDefinitionOf",
  "sourceMode": "chain",
  "verificationStatus": "confirmed",
  "notes": "Generated from live CityComponents componentDefinitionOf(2) on base.",
  "rarityPresentation": {
    "rarityTier": 1,
    "key": "common",
    "name": "Common",
    "frame": {
      "path512": "assets/frames/512/common.png",
      "publicUrl": "https://assets.inpinity.online/city/assets/frames/512/common.png",
      "transparentCenter": true,
      "masterSize": 512
    },
    "background": {
      "path512": "assets/backgrounds/512/common.png",
      "publicUrl": "https://assets.inpinity.online/city/assets/backgrounds/512/common.png",
      "masterSize": 512
    }
  }
}
